question,answer
اسٹیک ہولڈر کی ایکسپیکٹیشنز کے ساتھ ان کی انڈرسٹینڈنگ کو ایلائین میں لاتے ہوئے، ڈویلپمنٹ ٹیم سے ریکویئیرمنٹس کے ایفیکٹو کمیونیکیشن کو پانچ دن میں انشور کریں۔,ہاں
ڈیٹا بیس کے لیے اگر ٹریننگ ریکوائرڈ ہے تو اس سلسلے میں زین ٓپ نے ٓج جا کر مینجر سے ملنا ہے اور اپنے کنسرن بتانے ہیں,ہاں
اور پھر آپ نے اس کو علی اور احمد کے ساتھ ڈسکس بھی کرنا ہے,ہاں
جی آپ اس کا :م: ڈاکومنٹ :م: کمپلیٹ کر لیجئے گا,ہاں
ان کے اکاونٹ کی ڈیٹیلز بھی لے لیجیے گا فل ٹائم کے لیے,ہاں
اچھا احمد آپ میٹنگ کے بعد ٹیسٹ پلان شیئر کر دیجیے گا,ہاں
سو آپ سب لوگ ون ون پیج ڈیوائڈ کر لیں اینڈ احمد آپ دو دو پیجز کر لینا,ہاں
تو نیکسٹ میٹنگ میں آپ نے مجھے اپنے ریفرنس کے بارے میں انفارم کرنا ہے,ہاں
ابھی تک ہم نے جو مینلی ڈسکس کیا ہے وہ :م: یو آئی کا ڈسکس کیا ہے تو وہ :م: اس میں سارا :م: بتا لکھ دیجیے گا کہ کیا کیا ہے ٹھیک ہے باقی یو ایکس ہے تو اس کو بھی نوٹ کر لیجیے گا ساتھ ساتھ,ہاں
عائشہ اور بلال آپ دونوں نے پروڈکشن انوائرمنٹ میں ٹیسٹنگ پہ فوکس کرنا ہے,ہاں
صارم اور ارم آپ ٹیم کے ساتھ مل کر یوزرز کو انکلوسیو یوزر ایکسپیریئنس پراوائڈ کرنے کے لئے ایکسیسیبلٹی گائیڈ لائنز اور اسٹینڈرڈز بنائیں  ,ہاں
تو آپ لوگ ایک میٹنگ ارینج کر لیں ان کے ساتھ,ہاں
عائشہ نے فرائیڈے تک تک نئیو اور پرویوس پائیپ لائین کا کمپوریسن کرنا ہے,ہاں
اب جیسے اس میں بیسکس مین کیٹگریز رکھ لیں پھر مین کیٹیگریز کی سب کیٹیگریز رکھ کے پھر پراڈکٹس رکھ لیں تاکہ وہ تھوڑا سا یہ جو میسی سا انٹرفیس لگ رہا ہے ناں یہ نہ ہو,ہاں
فاطمہ آپ نے کل کو مجھے اپنے کام کی رپورٹ سینڈ کرنی ہے,ہاں
میم میں ابھی اس کو میل کر دیتی ہوں,ہاں
جی چلیں ٹھیک ہے اور آپ نے جو جو پوائنٹ میں نے ڈسکس کیے ہیں آپ نے {کاشف} کے ساتھ شیئر کرنے ہیں اور {ماریہ} آپ نے اپنی ٹیم کے ساتھ بھی شیئر کرنے ہیں جو میں نے فرنٹ یا اینڈ کے بارے میں آپ کو گائیڈ کیا ہے,ہاں
اسامہ آپ نے اس ہفتے میں ڈومین فائنل کرنی ہے ویب سائیڈ کی,ہاں
وہ یہ کہ آپ نے نیکسٹ میٹنگ میں کمپنی کو کو آرڈرز دینے ہیں اور اسکے بجٹ کی تمام تفصیلات سافٹ اور ہارڈ فارم میں سبمٹ کروانی ہیں,ہاں
ٹو ڈیز ہیں آپ کے پاس آپ ماورا کے ساتھ سٹنگ کر لو اور ان کی اولیبلٹی کنفرم کر کے مجھے انفارم کرو,ہاں
م جی م اسماء اینڈ خضری آپ لوگ ایسا کریں کہ مجھے ناں کل تک ایڈ کا ایک سیمپل دکھا دو ایڈٹ کر کے,ہاں
ٹھیک ہے اس اس چیز کو بھی ذرا :م: ذہن میں رکھ کے اپنے ڈاکومنٹ میں لکھ کے اینڈ دین جو ہے وہ پورے یو آئی کے فیز میں آپ نے اس طرح سے کام کرنا ہے,ہاں
نیکسٹ منڈے سے پہلے {حمد} آپ نے مجھے ڈیٹیل پلان شیئر کر کے دینا ہے اینوٹیشن,ہاں
تو آپ لوگ ایسا کرئے گا کہ پریویئس پروجیکٹ کا ڈیٹابیس ڈاکومنٹ دیکھ کر آئے گا,ہاں
اب آپ نے سکیجول بنا کہ   شیئر کرنا ہے,ہاں
اور مجھ سے ڈویلپمنٹ کی ٹائم لائن شیئر کر دینا آپ میٹنگ کے بعد,ہاں
عامر آپ بنا لیں ایک ای آر ڈی کسی بھی ٹول پہ,ہاں
ماڈل کو ڈیٹا کے سب سیٹ پر پرسوں تک ٹرین کریں۔,ہاں
کوئز مینیجمنٹ سسٹم کے لیے ڈیٹیلڈ ٹیسٹ کیسز لکھیں نیکسٹ میٹنگ تک,ہاں
لوکیشن بیسڈ ایڈورٹائزنگ کی  فنکشنیلیٹی کو ٹیسٹ کرنے کے لیے ایک پروٹو ٹائپ کو اگلے مہینے تک ریڈی کریں۔,ہاں
تو آپ لوگ ریکوائرمنٹ ڈاکومنٹ کو آج شام تک ہی کمپلیٹ کرکے مجھے سینڈ کریں,ہاں
وہ مجھے ایکسل کی ایک شیٹ بنا کر وہ میرے ساتھ شیئر کیجیے گا اور خضری اور اسماء آپ دونوں یہ کام کریں گے ٹھیک ہے پانچ لوگوں کے خضری کنڈکٹ لے گی انٹرویو پانچ کے اسماء کر لیا کرے گی ٹھیک ہے,ہاں
آپ  نے مجھے اب اپ ڈیٹس دینی ہے پروجیکٹ کے حوالے سے ڈیلی,ہاں
یہ بھی سسٹم ڈیزائن کے سٹیپ میں ایڈ کر لینا,ہاں
چلیں آپ نا ایسا کریں کہ مجھے یہ سینڈ کر دینا جتنا بھی بنا ہے,ہاں
م مزید اسائن کر دینا پھر رپورٹ کیجیے گا مجھے کہ یہ لوگ کس طرح سے جا رہی ہیں اور جو میں نے آپ کو بتائی ہیں ساری م ان پہ م جو آپ نے پابندیاں لگانی ہیں وہ آپ,ہاں
انڈرسٹینڈنگ اور پروجیکٹ کے سکوپ میں چینجینگ کی بیس پر ریکویئیرمنٹس کو بہتر اور اسی جمعے تک اپ ڈیٹ کریں۔,ہاں
حنظلہ ٓپ نے ریکارڈڈ تمام میٹنگز کو ڈوٹ ویو میں کنورٹ کر کے ڈرائیو پر کل تک اپلوڈ کرنا ہے,ہاں
اچھا آپ میں سے کوئی ساتھ ساتھ نوٹ کرتا جائے جو جو ہم ڈسکس کر رہے,ہاں
اگلے ہفتے تک وائر فریم بنائیں جو یہ شو کریں کہ لوکیشن بیس ایڈورٹائزمنٹ یوزر کو کیسے دکھائے جائیں گے۔,ہاں
ایک بار آپ لوگ سسٹم ڈیزائن ڈاکومنٹ کو بھی تھارولی گو تھرو کر لیں,ہاں
تو نیکسٹ منڈے کو ففٹینتھ ہے تو منڈے کو بلا لینا ان کو,ہاں
کنٹریکٹ سائن کروا لیجیے گا کہ ہم نے ان کو کتنے پیسے پہلے سبمٹ کروا دیے ہیں ٹھیک ہے تاکہ وہ بعد میں اس پہ کوئی ایشو کریئیٹ نہ کریں کہ م ہم نے ان کو کوئی م ایڈوانس وغیرہ پے نہیں کیا,ہاں
اور یہ ڈاکومنٹ مجھے میل کر دینا,ہاں
احمد اس میٹنگ کے بعد مجھے اس کی ای آر ڈی ڈائگرام چاہیے,ہاں
عمر یہ ہمارے پاس ایک نیا پروجیکٹ آیا ہے میں آپ کو اس کی ڈٹیل شئیر کرتا ہوں آپ نے مجھے دو دن کے اندر اس کے بارے میں ڈٹیل سے بتانا ہے,ہاں
سسٹم ایڈمنسٹر کے ساتھ اسکیل ابیلٹی ریکوائرمنٹس پر فورن ڈسکشن کریں ,ہاں
اور آپ نے مجھے ایک اور ڈاکومنٹ شئیر کرنا ہے ,ہاں
صحیح اچھا کاشف فائنل ڈاکومنٹ کلائنٹ کو سینڈ کرنا آپ کی رسپانسبلٹی  ہے ,ہاں
آپ ٹیسٹ سنیریوز کی بیس پہ دیکھ لینا,ہاں
جی آپ مجھے آج ہی بنا کر میل کر دو,ہاں
آپ ایک میٹنگ ایسا کریں کہ یو آئی ٹیم کے ساتھ کر لیں,ہاں
مشین لرننگ الگورتھم کے لیے سوٹیبل ڈیٹا کو کل تک پری پروسیس کریں۔,ہاں
ٹریکنگ سسٹم بھی کاشف اپلیمنٹ کرنا ہے ٓپ نے پروجیکٹ میں اور نیکسٹ میٹنگ میں اپڈیٹ دینی ہے,ہاں
اب آپ کا یہ ٹاسک ہے کہ آپ اگلی میٹنگ میں مجھے تمام صورتحال سے آگاہ کریں,ہاں
بناو گوگل شیٹ ٹھیک ہے اس کے بارے میں ٹاپکس لکھو اور ہمارے ساتھ شئیر کردو میرے اور انعم کے ساتھ,ہاں
مجھے میٹنگ سے پہلے ہی ریویو کروایے گا ایک بار,ہاں
کولیکٹ کی گئی ریکویئیرمنٹس کے لیے تصدیق کے عمل کی پلاننگ کے لیے کام کل تک پورا کریں۔,ہاں
اچھا علی آپ اویلوئیشن میٹرکس کی لسٹ ایس کیو اے والوں کے ساتھ شیئر کر دیجئے گا,ہاں
ان کے پروز اور کونز نوٹ کر نے ہیں,ہاں
حدید آپ پرپیئر کریں گے اسے,ہاں
اب آپ نے انہی کے اکارڈنگ بنانا ہے انٹرفیس,ہاں
اویس آپنے اس کی رن ٹائم پہ ٹیسٹنگ کر کے دکھانی ہے,ہاں
اچھا سمیر مجھے ایک ویل ڈاکومنٹڈ رول بیک پلان چائیے,ہاں
م اچھا ایک اور کام کرنا ہے آپ نے کہ م آپ سارہ سے جو ہے پوچھ کر ٹاسک فائنل کرو کہ آفٹر ہائرنگ جو ہے ٹو ڈیز اور اویلوئیشن ہو گی,ہاں
م اچھا تو ماورا سے کہہ دیں م کہہ دیجیے گا آپ کہ اسی ویک جو ہے ناں انٹرویو وغیرہ کنڈکٹ کروا دیں ان کا مس ثمرہ کے ساتھ ٹھیک ہے اگر مس ثمرہ اویلیبل ہیں تو ٹھیک ہے,ہاں
اچھا آپ نے ٹیسٹ ڈیٹا بنانے کے بعد مجھے چیک کروانا ہے ,ہاں
عائشہ آپ نے ویب سائیڈ کا تھیم اور کلر سکیم سلیکٹ کرنی ہے,ہاں
میں پھر دوبارہ بلاوں گا آپ کو آپ تب تک ان کے اویلوئیشن ٹاسکس فائنلائز کر لو,ہاں
ڈیٹا کو کلیکٹ کریں اور ٹریننگ اور ٹیسٹنگ کا ڈیٹا ایمان ٓپ نے سپریٹ کرنا ہے,ہاں
اچھا :م: آپ ناں :م: {سید حمزہ} آپ ایسے کرنا کہ آپ {ایمان فاطمہ} کے ساتھ بھی ناں کنسلٹ کر لینا اس حوالے سے ٹھیک ہے پھر :م: {ایمان فاطمہ} آپ مجھے کل اس کے بارے میں ناں انفارم کر دینا کہ کون سا ٹول ڈیسائیڈ ہوا ہے,ہاں
مجھے ٓپ نے لسٹ ای میل کرنی ہے اور باقی سب ممبرز کو بھی,ہاں
لائک انٹرویوز تو آپ نے ویسے بھی کر لیے ہوئے ہیں,نہیں
سر سرچ کے لیے بھی ایک انٹرفیس پرووائیڈ کرنا ہوگا نا,نہیں
جیسے کے موبائل فونز ٹیبلیٹس واچز وغیرہ,نہیں
کے تھرو ہی ہمیں بھی پتا چلے گا اور آپ کو بھی کہ م دھرنا کب تک چلنے والا ہے,نہیں
سر اس کی ورکنگ ایسے ہے کہ اس میں پکچرز میں کراپس یا سیپریٹ ڈائزیزیز سیمٹمز کے اراؤنڈ ریکٹینگولر باکسس ڈرا,نہیں
م آگے میں کیا تھا کہ ایک انگلش,نہیں
اس کے علاوہ وارنٹی بھی انہوں نے ایک سال کی مینشن کی ہے میں بات کرتا ہوں,نہیں
ماڈل بہت زیادہ ایکوریٹ ریزلٹس نہیں دے رہا,نہیں
جی وہ ایپلیکنٹ ٹریکنگ سسٹم سے چیٹ بوٹ کوانٹیگریٹ کرنا تھا,نہیں
تھوڑا سا بڑھا دیں لیکن مینلی ہماری ناں دونوں کے لیے ٹوئنٹی اور ٹوئنٹی فائیو کے درمیان ہی ہوتی ہے,نہیں
م میم یہ بجٹ تھا جو فرسٹ فیز میں ہمیں ملا تھا وہ تقریبا فور ملینز کا تھا,نہیں
اس کی وجہ بجٹ نیگوسیئشن اور ریکوائرمنٹ اگین ڈیزائن کرنا پڑ رہا ہے,نہیں
نہیں وہ پبلش نہیں کرنا پڑتا لیکن جب آپ کنٹریبیوشنز کی بات کرتے ہیں تو کنٹریبیوشنز کا مطلب ہو ہے سگنیفکینٹ چیز ہے تو آج کل :م: جو پلس پوائنٹ یہ ہوتا ہے کسی بھی پیپر کے اندر کہ کسی نے اپنا ڈیٹا جو ہے وہ پبلکلی اویلیبل کر دیا,نہیں
 اور عمار آپ کا کوئی ریفرینس ہے,نہیں
یہ جو کویسشنز آپ پرپئیر کریں گے,نہیں
میم آلریڈی ہم ڈفرنٹ ماڈیولز پہ یونٹ ٹیسٹنگ کمپلیٹ کر چکے ہیں,نہیں
وعلیکم السلام ہاں جی کیا حال چال ہیں آپ کے,نہیں
جی تو بلز ریڈی ہیں جو اقراء کی ٹیم ریکارڈنگز کے لیے گئی تھی اسلام آباد تو ان کا سارا ایکسپینس وغیرہ,نہیں
ایک دفعہ ناں احمد چیمہ کو کنسلٹ کر لیں,نہیں
:م: سو ناؤ وی شڈ موو آن آگے دیکھتے ہیں کہ,نہیں
سپیکر محمد مالک کافی پرانے سپیکر ہیں ہمارے سسٹم میں اور ان کی وائس کافی,نہیں
جی جی آپ ناں آن لائن,نہیں
جو ای سیز تھے وہ تو تھے تین لاکھ کے دونوں,نہیں
اور اگر ورڈ کے اینڈ پہ ہیں تو بھی ان کی ڈفرنٹ شیپ ہے,نہیں
بینکنگ فیلڈ سے ریٹائرڈ ہیں یا لیو کی تھی خود,نہیں
چینجینگ لائبہ نے کی تھی تو لنک ان کے پاس ہی ہیں,نہیں
م میرا نیکسٹ یہ ہے کہ میں نے پہلے م یہ,نہیں
جو ہے ڈیٹا کی ڈائیورس :م: جو رینج آ جائے گی یعنی ہر طرح کا ڈیٹا ہمارے پاس آ جائے گا,نہیں
پہلے فیز میں تو ہمیں یہی کرنا پڑے گا کہ ہمیں ڈیٹا کلیکٹ کرنا پڑے گا اس کے لیے تو ہم میکسیمم جونسا ہیں جو ہمیں کمپنی الاؤ کر رہی ہے,نہیں
اور دوسرا ان کو آپ نے جو کہنا ہے وہ ان کو ٹائم لمٹ دینا ہے اور ان کو کہنا ہے کہ مجھے میل بھیجا کریں یہ لوگ,نہیں
زیادہ جو ہے وہ مشکل ہو جائے گا تو اس لیے آپ لوگ جو ہے وہ اپنے آپ کو اتنی مشکل میں نہیں آپ لوگوں نے ڈالنا لیکن یہ ہے کہ آپ لوگوں نے کوالٹی کا خاص خیال رکھنا ہے اور ایک چیز سب سے امپورٹنٹ جو بھی ٹاپک آپ سلیکٹ کریں گے اور اس کے حوالے سے جو آپ لکھیں گے,نہیں
م یہ تو پھر ایک قسم کا ہمیں نقصان ہی ہے پھر ہم,نہیں
یعنی کہ آپ لوگوں کا کہنا یہ ہے کہ ہم لوگ ایک سے دو م ایکسپیرئنسڈ جو ہے ناں بلاک چین ڈویلپرز ہائر کر لیں,نہیں
ہائے لے خود بتا بھی دیا تو انہوں نے پہلی ہی اور پھر,نہیں
م آپ کی میں اسپیشلی عبداللہ کی جو مطلب کہ آپ کی جو چیزیں ہیں کیونکہ آپ کے سٹڈی کی ہیں,نہیں
تو کر لیں گے لیکن باقی یہ کہ سی ویز جو آپ لوگوں کے پاس پڑی ہیں اس میں نے آپ کو جس طرح پہلے بھی بتایا کہ بیک اپ ریڈی رکھیں ہو سکتا ہے کہ ان,نہیں
بیشک ہمیں یہاں سے بجٹ اینڈ فنانس ڈپارٹمنٹ سے مزید بجٹ آ بھی جائے ناں,نہیں
[بیک اینڈ] میں سپرنگ بوٹ یا پھر :م: پائتھن جینگو,نہیں
بٹ اب یہ لوگ یہاں لاہور شفٹ ہو گئے ہیں,نہیں
فورٹی پرسنٹ جو ہے تھرٹی پرسنٹ سوری جب ہمارا پروجیکٹ ہاف کمپلیٹ ہو چکا ہو گا,نہیں
م ختم کر دیا جاتا ہے,نہیں
کہ ہم پہلے تو ان کو ایک اوریجنل پروڈکٹ کے پہلے پیسے پے کریں پھر اگر وارنٹی جو کہ ان کا حق ہے ہمیں دینا وہ ہمیں تھوڑی سی دے رہے ہیں تو اگر ہم بڑھوانے کا کہیں تو الٹا ہم سے ہی پیسے چارج کر لیں,نہیں
بٹ ایک یہ ہوتا ہے کہ جو,نہیں
اور اس کے علاوہ جو سیلری انکریمنٹس کے ڈاکومنٹیشن تھی تو اور بھی جو ساری ڈاکومنٹیشنز ہے وہ بھی میں ان ان کے ساتھ ناں ڈسکس کر لوں گی,نہیں
م کس نے کس ٹاپک پہ کرنا ہے اور کیا ہونی ہے,نہیں
نہیں بیسکلی ہم لوگ اتنی اماونٹ مانگ ہی نہیں سکتے ناں کیونکہ انہوں نے آلریڈی کہہ دیا تھا کہ فنڈنگ کی شارٹیج کی وجہ سے وہ آنلی ون ملین ہی فرسٹ شفٹ میں دیں گے اس لیے,نہیں
میم ایکچوئلی یہ ہی ڈسکس کرنا تھا آپ,نہیں
میم میرے نزدیک تو پازیٹیو ہے,نہیں
اور سر جو ہم وہ اس پہ,نہیں
جی سر ایک اور پراجیکٹ ہے جس کی ہم نے ٹیسٹنگ کب کی کر لی ہے بس اس کے ایررز  کا انیلسز کرنا ہے ,نہیں
تو پھر یہ م جو ہے کمپنی کو اگر ہم رپیئر کے لیے بھیجتے ہیں یا ریٹرن کرنے کے لیے تو ہمیں یہ کہہ کے واپس بھجوا دیتے ہیں کہ جی ہم نے آپ کو سال کی گارنٹی دی تھی سال سے اوپر ایک ماہ بھی ہم نہیں دیکھیں گے,نہیں
لوکل لینگویج کمپیوٹنگ ایریا میں پرائیور ایکسپیریئنس اور ریسرچ پبلیکیشن میں ایکسپیرئنس,نہیں
جیسے ہمارا فرنٹ اینڈ جاواسکرپٹ کے فریم ورک ریئکٹ پہ ریلائے کرتا ہے,نہیں
ان کے سیکیورٹی لیولز کروپ سٹیجز وغیرہ,نہیں
کو ہائر کرنا ہے تو یہ بیسک ایکشن آئٹمز ہوتے ہیں ان کو آپ مارک کریں گے گرین کلر کے ساتھ ٹھیک ہے اور وہاں پہ آپ یس لکھ دیں گے,نہیں
اس پہ مشتمل ہو گا یا اس سے زیادہ پہ ہو گا تو وہ اچھا یا برا لگے گا ایستھٹیکلی,نہیں
جی جی ایکچوئلی میری بات ہوئی تھی م ان سے ناں اس حوالے سے,نہیں
ہاں بالکل آپ آپ نے صحیح بتایا ہے,نہیں
اس کے علاوہ میم جو ان کی سیلری ڈیمانڈ تھی ناں وہ ہم نے شیٹ میں مینشن مطلب کی ہوئی ہے وہ آپ سے ڈسکس کر لیں گے جب آپ آئیں گی ناں,نہیں
آپ بتائیں کہ کیا ہم نے سپیسفکلی بی ایس کے سٹوڈنٹس کو ہی کرنا ہے یا صرف ہمیں جو لنگوسٹ اور ٹیکنیکلز ہیں اپنی فیلڈ سے ریلیٹڈ ڈگری ہولڈرز انھیں کو کنسیڈر کرنا ہے  ,نہیں
تو کیا وہ الیجیبل ہیں انکریمنٹ کے لیے,نہیں
کرنا ہے تو ایک دن پھر بھی آنا پڑے گا تو,نہیں
اچھا اور م سمیع اللہ آپ کس کمپنی کے آرڈر کر رہے ہیں لیپ ٹاپس اور کمپیوٹرز,نہیں
سٹاف ممبرز یا امپلائز ان کو اپنے ساتھ انکلوڈ کریں بے شک ایچ آر ٹیم میں سے جو کر لیں ہمار پاس ہیں,نہیں
اور اس کے بعد آلموسٹ تو میں نے سارے ڈاکومنٹس م سبمٹ کروا دیئے تھے بس ایک ڈاکومنٹ رہ گیا تھا وہ بجٹ کے بارے میں,نہیں
ون پوائنٹ سکس ہے ادھر بھی ون ہی ہونا چاہیے ناں اگر ٹیبل کنٹینٹ کو دیکھا جائے لیکن یہاں پیج ٹو ہے,نہیں
سینٹینس لیول اور ٹوکن لیول ٹاسکس میں اسٹیٹ آف دی آرٹ پرفارمنس دیتا ہے,نہیں
کیونکہ اگر ہم سکس ڈیز رک جائیں گے تو پھر تو زیادہ ٹائم ہو جائے گا ہمیں ہائرنگ ارجنٹ بیسز پہ کرنی ہے,نہیں
یس میم فرسٹ فور فل کمپلیٹ ہیں,نہیں
یہ ہمیں ریسورسز کو ڈیمانڈ کے اکارڈنگ سکیل اپ یا ڈاؤن کرنے کی فسیلیٹی دیتا ہے,نہیں
صحیح اچھا آپ کویاد ہوگا کہ کل میں نے آپ سے کراس پراجیکٹ ہائیرنگ کے بارے میں بات کی تھی اگر آپ کو یاد ہو,نہیں
وہ تقریبا میرے خیال دس پندرہ ہزار کا خرچہ بتا رہا تھا تو پھر بعد میں ہمیں پتا چلا تھا,نہیں
اب وہ ڈاکٹر اسد سے بات کریں گے تو دیکھتے ہیں پھر کیا کہتے ہیں,نہیں
وہ ایک آن لائن ٹول بنایا ہوا ہے جہاں پہ آپ اپنے ٹیگز بتا دیتے ہیں,نہیں
کیوں کہ اگر :م: کسی نے دیکھ دیکھنا ہو کہ یہ سٹوڈنٹ کس ہاسٹل کا ہے :م:,نہیں
جو ہے ناں انہوں نے ایڈ وہ بھی ایڈ جو ہیں وہ انہوں نے کرا دیے ہیں,نہیں
م ریسرچ اسٹنٹ کے طور پہ کام کریں,نہیں
کلائنٹ سے دوبارہ سے ویریفائی کر لیں گے,نہیں
ہم نے جو جو ڈیزائننگ کی ٹکنیکس اور جو جو ڈاکومنٹس بنانے ہیں,نہیں
سر آپ کی بات اپنی جگہ درست ہے بٹ ہماری بھی مجبوری ہے,نہیں
{عروسہ} مجھے لگ رہا ہے کہ ان کا انٹرنیٹ ڈسکنیکٹ ہو گیا,نہیں
پروجیکٹ کا جو ابھی ہمیں م ابھی کمپیئر تو نہیں ہوا تو ابھی ہمیں کچھ آئیڈیا نہیں ہے کہ مزید اس پہ کتنے لگ سکتے ہیں تو اگر ہم نے ان کو زیادہ پے کر,نہیں
تو ہم اسی میں سے پھر دیکھ لیں گے کہ ہمیں کیا انکلوڈ یا ایکسکلوڈ کرنا ہے,نہیں
سر وہ کمپنی کی طرف سے سروے کے لیے یہ دونوں  بھی گئے تھے,نہیں
سنیریو کو دیکھیں تو ہمیں اپنی جیسے بچت کر کے ہی چلنا چاہیے,نہیں
آپ ویک وائز نہ شو کروائیں میں آپ کو اس کا تو مسئلہ ہی نہیں ہے,نہیں
ایڈیشنل یا آپ نے ان کے جو :م: سپیسفک سکلز سیٹ ہے :م: اچھا میں یہ کہہ رہا تھا کہ آپ لوگوں نے :م: جو آپ کے پاس :م: سپیسفک :م: وہ جو آپ لوگوں کے پاس نیم ہو گا,نہیں
کہ کونسا کام کتنا کمپلیٹ ہو گیا,نہیں
ویک ڈیز میں اویلیبل ہوں گے,نہیں
پیمرا کی طرف سے یا پیپرا کی,نہیں
ہاں جی اب کلیئر ہے تو ٹھیک ہے صحیح ہے اور مشین لرننگ کا آئیڈیا تھا ان کو,نہیں
میم اس کا سولیوشن ہو گا ہمارے پاس ہم اپنی ریکوائرمنٹ کو,نہیں
ویسے ایسٹیمیٹڈ ٹائم پوچھا ہے آپ نے ان سے کہ کب تک وہ باقی فنڈز سینڈ کریں گے,نہیں
ففٹینتھ جو ہے جون تک سب فائنل کر لیجیے گا تو پھر م اینڈ آف دی منتھ جو ہے یا سٹارٹ آف دا جولائی پھر جو پھر ان کی ٹریننگ بھی ہم سٹارٹ کریں گے,نہیں
جیسے سنکرونائیزیشن یا اپ ٹو ڈیٹ انفارمیشن کا ایشو,نہیں
سر دراصل نہ مجھے آپ کی لاسٹ ٹو میلز ریسیو نہیں ہوئیں,نہیں
اولڈ امپلائز ہیں وہ دو دن وہ آئیں گے دو دن یہ آئیں گے پھر ایک دن جو ہے تھوڑا سا مکس اپ کر کے تو اس طرح سے مینج کر لیتے ہیں,نہیں
ریکارڈنگ سر اویلیبل ہو گی انشاء اللہ,نہیں
اور اس کے علاوہ آپ میں سے کسی نے پراجیکٹ کے بارے میں ڈسکشن کرنی ہو,نہیں
ڈیٹیلز پر اٹینشن پے کرے گا ,نہیں
جو ڈیٹا لے کر آئے گا,نہیں
ٹھیک ہے سبحان پھر آپ جو چیزیں آپ نجم سے ویریفائی کروا لیں جو چیزیں پہلے ایپلیکیشن میں جا چکی ہیں وہ چیزیں پھر آپ نے انکلوڈ نہیں کرنی,نہیں
چلیں دیکھ لیں گے اس کو,نہیں
چلیں نیکسٹ موو ان  کرتے ہیں,نہیں
میں نے لیپ ٹاپس کے لیے بھی کہا تھا سر کامران سے ان,نہیں
:م: کہ ہم جونسا ہے وہ سیم ویڈیو ہی لیں گے دونوں کو,نہیں
تو ابھی تک کے لیے ہم لوگوں نے ڈسکس کیا کہ,نہیں
کیے گئے ہیں تو :م: ان کا آئیدیا نہیں لے سکے گا,نہیں
اپ لوگ ڈیویلپمنٹ ٹیم کے ساتھ رابطے میں رہیے گا ان فیس کے درمیان,نہیں
لیکن م کوشش کیجیے گا کہ تیس کے اندر اندر ہم نے رہنا ہے اس سے زیادہ ابوو نہ جائے بجٹ,نہیں
