question,answer
اوکے پھر آپ لوگ مجھے آج ہی یہ ڈاکومنٹ سینڈ کر دینا,ہاں
جو ہے وہ م کشف سے بھی بجٹ کیلکولیٹ کر کے رکھو,ہاں
آپ نے میم ماورا سے کونٹیکٹ  کرنا ہے,ہاں
باقی مریم  اور ثنا آپ نے  یوزر انٹرفیس ڈویلپمنٹ کرنی ہے,ہاں
جی بلکل  آپ نے اس کے لیے پرمیشن لیٹر لکھنا ہے  ,ہاں
اچھا ایسا کریں کاشف کے آپ ایک گوگل شیٹ بھی بنا لیں ,ہاں
سیکیورٹی اور پرفارمنس کے ایشوز کو ریحان ٓپ اور ٓپ کی ٹیم ایڈریس کرے گی اور ان کو سولو کرے گی,ہاں
عمر آپ نے سارے انٹرویوز اپنی نگرانی میں کنڈیکٹ کرنے ہیں,ہاں
تو آپ اس پہ بھی ٹیسٹنگ کر لیجیے گا وہ تو ہیوی ہوتا ہے تو آپ ایسا کریں لیب میں جی پی یو پڑے ہیں تو اس کے اوپر آپ ٹیسٹنگ کر سکتے ہیں,ہاں
پھر مجھے آپ نے اپ ڈیٹ کرنا ہے اس حوالے سے عائزہ,ہاں
تو ٹھیک ہے پھر ان کو بلا لینا,ہاں
ریکویئیرمنٹس اور پروجیکٹ ڈیلیور ایبلز کے درمیان ٹریس ایبلٹی کو چھ دن میں قائم کریں,ہاں
آپ لوگوں نے کل تک ایلگو کی ایمپرومنٹ اور انٹی گریشن کرنی ہے,ہاں
سارہ آپ کر دینا مجھے سینڈ ,ہاں
ریحان ٓپ نا مجھے اپنی ٹیم کی پروگریس رپورٹ میٹنگ کے فورا بعد سینڈ کریں اور ٹائم ٹو ٹائم اب ٓپ نے سینڈ کیا کرنی ہے,ہاں
آپ پھر میرے ساتھ شئیر کر دیجیئے سارا کوڈ اور رننگ ایپلیکیشن,ہاں
اور رہی بات انٹرفیس کہ اس میں آپ نے ساری ٹیسٹنگ ٹیکنیکس یوز کرنی ہیں,ہاں
اگر ڈیورنگ انٹیگریشن کوئی بھی ایشو ارائز ہوتے ہیں تو آپ نے کمیونیکیٹ کرنے ہیں,ہاں
آپ یوں کرنا کل شام کو میرے آفس آ جانا,ہاں
ماورا سے کہنا کہ ڈاکومنٹس ویریفائی کر لے,ہاں
سب سے ایکوریٹ اور ایفیشنٹ ماڈل فائنڈ کرنے کے لیے ڈفرینٹ آرکیٹیکچرز کے ساتھ چار ہفتے ایکسپیرمینٹ کریں۔,ہاں
جو ٹیکسٹ میں سٹاپ ورڈز ہوں گے آپ انہیں بھی دیکھ لیجیے گا,ہاں
کل کو آپ لوگوں نے ایچ آر آفسر کی ہائر نگ کرنی ہے,ہاں
ویب ایپ سیکیورٹی میں جن جن چیزوں کو ٹیسٹ کرنا ہوتا ہے احمد آپ ان کی لسٹ بنا ئے گے,ہاں
اور ٹیسٹ انوائرمنٹ سیٹ اپ کر لیں نیکسٹ ویک تک,ہاں
ڈیٹا بیسز پر بھی ڈسکشن کرنی ہے ٓپ نے تیم کے ساتھ اس میٹنگ کے بعد,ہاں
انٹرنز کو تو آپ نے خود دیکھنا ہے ان کو بس اویلوئیٹ کر کے مجھے بتا دینا,ہاں
آپ لوگوں نے کل تک پی پی ٹی فائنل کرنی ہے,ہاں
اس کے علاوہ آپ مجھے نیکسٹ میٹنگ میں پراجیکٹ پروپوزل ڈاکومنٹ دیں گی,ہاں
ویلیڈیشن سٹریٹجی جس میں ٹرین ٹیسٹ سپلٹ ہے یا اس کے علاوہ جو بھی اپ یوز کریں پروجیکٹ مینیجر کو انفارم کرنا ہے اپ نے  ,ہاں
چلیں ٹھیک ہے اور {لائبہ} گروپ آپ بنا لیجیے گا,ہاں
اور جن میں تھوڑی اگر کنفیوژن ہو گی اس کے آگے کراس مارک کر دینا پھر ہم اس کو لاسٹ میں دیکھ لے گے ,ہاں
اوکے پھر ورکنگ کریں آپ لوگ اور مجھے اپ ڈیٹ کریں,ہاں
پورے پراجیکٹ لائف سائیکل کے دوران ریکویئیرمنٹس کی تبدیلیوں کو ایسٹیبلیش کرنے کے لیے ایک پروسس کو اسی ہفتے میں قائم کریں۔,ہاں
اس کا ناں :م: ایپلیکیشن کی اے پی کی فائل آپ نے مجھے سینڈ دے,ہاں
آپ نے ادھر جیسے اب سیگمنٹ لکھا ہے نہ یہاں ہم نے بلاک لکھنا ہے,ہاں
ٹھیک ہے آپ اس کی انکوائری پہلے آفس بوائے سے کر لیں,ہاں
احمد آپ کوئز مینجمنٹ سسٹم اور ایکسٹرنل کمپوننٹس کے درمیان ڈیٹا فلو کو ڈفائن کریں,ہاں
علی آپ نے یہ ویریفائی کرنا ہے کہ جو لوگ ڈاکومنٹ جمع کروائیں ان کے ساتھ ان کی رپورٹس لازمی اٹیچ ہوں,ہاں
اوکے دین نجم آپ اپنی ٹیم کے ساتھ مل کر یہ ٹاسک کمپلیٹ کریں ,ہاں
کنٹینٹ کی ایکیوریسی اور  اتھینٹی سیٹی کو انشور کرنے کے لیے علماء یا ماہرین کے ساتھ اسی ہفتے میں کلیبوریٹ کریں۔,ہاں
ہاں ٹھیک ہے اور ایسا کریں کہ نیکسٹ میٹنگ کے لیے آپ لوگ ذیشان اور آپ مجھے پراجیکٹ ڈسکرپشن کا ایک ڈاکومنٹ سبمٹ کر وائیں گے فرائیڈے تک ٹھیک ہے,ہاں
جی نیکسٹ میٹنگ تک آپ نے ماورا سے ایڈ کے بارے میں فائنلائز کر کے مجھے انفارم کرنا ہے,ہاں
اور پھر نیکسٹ میٹنگ میں آپ مجھےذمہ داران کی فائنل رپورٹ پیش کریں گے,ہاں
حنا آپ کا ٹاسک یہ ہے کہ آپ کوئزز سوالات یوزر ڈیٹا رزلٹس اور  اہم اینٹٹیز کے لیے ٹیبلز بنائیں گیں,ہاں
اوکے سو نیکسٹ میٹنگ میں آپ دونوں نےانٹرنز کے نیمز شارٹ لسٹ کر لانے ہیں,ہاں
عمار آپ نے ڈیٹا کو بڑھانے کے لئیے کچھ اور میٹنگ کنڈیکٹ کرنی ہیں,ہاں
:م: {ثناء} آپ نے :م: ڈیٹا ویلیڈیشن کرنی ہے مجھے ڈاکومنٹڈ فارم میں ڈیٹا کی ویلڈیشن رپورٹ آپ نے دینی ہے ڈیٹا کلیم :م: کے ماڈیول کے بعد,ہاں
آپ پھر ایسا کریں کہ ایک پروپوزل مجھے میل پر سینڈ کریں,ہاں
اس کے علاوہ کمپنی کو بھی ٹینڈر کا نو ٹس فاٹو کاپی کروا کے بھیج دیں تاکہ کمپنی آرڈر پر کام سٹارٹ کردے,ہاں
ڈیٹا میں کسی طرح کی غلطی کو کریکٹ کرنا ہے ٓپ نے,ہاں
برئیرہ آپ نے نا جو ہماری ویب سائیڈ پہ پم نے ڈیمواکاؤنٹ بنایا ہے نا اس میں جو ہماری میٹنگز آتی ہیں جن میں ہمارے اچھے ایکشن ایٹمز نکلتے ہیں وہ آپ نے اس اکاؤنٹ میں ایڈ کر دینی ہیں,ہاں
پھر آپ مجھے میٹنگ کے بعد میل کر دیں,ہاں
آلرائٹ آپ لوگوں نے اینوٹیشن گائیڈلائنز پر کام کرنا ہے تاکہ اینوٹیٹرز کو ہیلپ پرووائیڈ کی جاسکے,ہاں
ٹیم کے  میمبرز کو اس اوپینیئن کو کولیکٹ کرنے اور فیوچر کی میٹنگوں کے لیے ایمپروومنٹ کرنے کے لیے پرسوں تک آسائین کریں۔,ہاں
جی اور اس کے علاوہ آپ نے  ٹیسٹ سکرپٹ بھی پرووائیڈ کرنی ہے,ہاں
ہارون آپ نے کل کو سٹال پہ انٹرویوز کنڈیکٹ کرنے ہیں,ہاں
دین پھر مجھے فرائیڈے تک اس کے بارے میں انفارم کر دینا ہے آپ نے,ہاں
ڈیٹا کو چھوٹے حصوں میں ڈیوائیڈ کر کےاس پر ماڈل کی ٹیسٹنگ کرنی ہے نیکسٹ میٹنگ تک,ہاں
چیٹ بوٹ کے سکریننگ ریزلٹس کو مینوئل ریزلٹس کے اگینسٹ ویلیڈیٹ کرنا ہے,ہاں
نیکسٹ ویک تک ٹارگٹ ٓڈینس اور اینڈ ہوزرز کو سپیسیفائے کرنا ہے ,ہاں
اچھا آپ نے ایک کام کرنا ہے یہ ڈاکومنٹ میم فراح کو بھی سبمنٹ کرنا ہے ,ہاں
ٹھیک ہے چلیں یہ کام تو نہیں کرنا پڑے گا اب اس کے اوپر ناں بلڈنگ کرنی ہے ایک دفعہ [اے ایس آر] کی تو وہ {اویس} آپ اپنے پلان میں ضرور ڈالیے ٹھیک ہے,ہاں
:م: اور اس کے بعد جو فرنٹ اینڈ کی ٹیم ہے اس کے ساتھ :م: ان کے ساتھ بھی آپ میٹنگ کر لیجیے گا ایون آپ دونوں ہی کر لیجیے گا تو بیٹر ہو گا آپ ایزیلی ان کو سمجھا دیں گے,ہاں
ولی ٓپ نا پرسوں تک ٹیم ممبرز اسائن کرنے ہیں پروٹوٹائپ اور موک اپس کے ریویوز کے لیے,ہاں
فار دس پرپز یو ہیو ٹو رائٹ این آفیشل ریکویسٹ لیٹر ٹو دی ٹیکنیکل ٹیم,ہاں
ٹھیک ہے جو بھی آپ کی فائنڈنگز ہوں گی اس کی آپ نے ایک ٹیکسٹ فائل بنا لینی ہے یا کوئی بھی ڈاکومنٹ :م: ورڈ کی فائل بنا لیں آپ کسی بھی طرح سے بس اس کو ایک پریزنٹ کر دیں,ہاں
اچھا :م: آپ ناں ایسا کیجیئے گا ساتھ ساتھ کہ ناں ایک ڈاکومنٹ بناتے جائیے گا,ہاں
اینڈ ون مور تھینگ کہ یہ ڈاکومنٹ آفس گروپ میں شیئر کر دینا,ہاں
اب آپ کا یہ ٹاسک ہے کہ آپ کسٹمر کو کال کرکے ساری صورتحال سے آگاہ کریں اور مجھے کسٹمرکے رسپانس سے اپڈیٹ کریں,ہاں
احمد اور ارحم مینلی آپ دونوں نے ٹیکنیکل اینڈ پہ ایشوز کو ریزولو کرنا ہے,ہاں
اس کے ساتھ ایک کاپی مجھے بھی سینڈ کرنی ہے,ہاں
خضرا آپ نے اسی ویک میں کوئی سوٹیبل ڈیومین نیم سلیکٹ کرنا ہے,ہاں
خضرا آپ نے سلینم کی ساری کومانڈز پڑھ کے آنی ہیں اور ان کو نیکسٹ میٹنگ میں ایکسپلیں کرنا ہے,ہاں
مزید ڈسکشن کی ضرورت ہوئی تو ایک میٹنگ رکھ لیں گے,ہاں
اور اویس آپ ایکشن آئٹمز پہ کام کریں گے اور ویب بیسڈ ایپ ڈویلپ کریں گے,ہاں
او کے یہ بھی ڈاکومنٹ میں ایڈ کر لینا,ہاں
اس کے یہ ٹیبل فل آوٹ کریں تھوڑا سا ریوائز کرنا ہے ان ٹاپکس کو جو آپ کے سافٹ ویئر,ہاں
پوری جو ہے بریرہ اور مائرہ آپ دونوں کی جو ریسپانسبلٹی ہے کہ آپ لوگوں نے یہ مجھے سینڈ کرنی ہے واٹس ایپ پہ ٹھیک ہے اور یہ کام آج ہی ہونا چاہئیے,ہاں
اچھا پھر آپ آئٹریٹیو ایمپروومنٹ پر بھی لازمی فوکس کریں,ہاں
آپ لوگ ٹرائی کریں کے ایز ارلی ایز ایز پاسیبل ان ایشوز کو ریزولو کر لیں,ہاں
عمار آپ نے کل سے انگلش ایکشن اٹمز کو اردو میں خود لکھنا ہے,ہاں
جی بلکل آپ یہ بھی پوائنٹ ایڈ کریں ,ہاں
تو ایسا کریں گے آپ خود ان کے ڈاکومنٹس وغیرہ لے لیں ان کو ویریفائی کریں اور ڈیپارٹمنٹ میں میل کر دیں,ہاں
آپ ان کے ساتھ کوآرڈینیٹ کر لینا,ہاں
اور پلیز مجھے ٹیکنیکلز کے اسیسمنٹ فارمز میل کر دیجیے گا میں نے ان کو فارورڈ کرنے ہیں,ہاں
کنسرنڈ بنکس وزٹ کر کے آپ نے رمیننگ بیلنس دوسرے اکاونٹس میں ٹرانسفر کرنا ہے,ہاں
اٹس اوکے نیکسٹ ٹائم آپ نے مجھے میل کرنی ہے,ہاں
تو باقی تو {ولی} :م: اگر ٹھیک ہے تو اس کے علاوہ مزید آپ کو ایشوز وغیرہ آئیں گے تو آپ ان کے ساتھ ڈسکس کر لیجیے گا,ہاں
اچھا یہ کہ ہر ریلیز کے بعد پروڈکشن ڈیٹابیس کو پاپولیٹ کرنے کے لئے حسن آپ لیٹیسٹ بیک اپس کو ریسٹور کروائیں گے    ,ہاں
فالو اپ سیشنز کے لیے کمیونیکیشن اور شیڈولنگ کو ہینڈل کے لیے ٹیم کے اراکین کو اسی مہینے میں آسائین کریں۔,ہاں
اور ایک ایسٹیمیٹڈ پلان ریڈی کرنا ہے جس میں اپ کمنگ ایکسپینسز کی ڈیٹیل ہو,ہاں
اچھا تو آپ نا برٹ کے بارے میں تھورا نالج لے لینا,ہاں
اب آپ لوگوں نے سسٹم ڈیزائن ڈاکومنٹ بنانا ہے,ہاں
ان کی ریکوائرمنٹس اور ڈاکومنٹیشن کو ریویو کرو,ہاں
 یوں کر لینا کہ جن سپیسیفیکیشنز پہ اویلوئیشن کرائیٹیریا ڈیپنڈ کر رہا ہے انکی لسٹ بنا کر انکو پرووائیڈ کر دینا,ہاں
ریکورمںٹس کو بہتر بنانے کے لیے پروٹوٹائپس پر اسٹیک ہولڈرز سے فیڈبیک کولیکٹ کریں۔,ہاں
:م: کوئی ایشو نہیں آپ انٹرنی ہائر کر لیں یا اگر آپ نے :م: کوئی ڈویلپر ہائر کرنا ہے سوئفٹ ڈویلپر تو اسے ہائر کر لیں,ہاں
ٹھیک ہے پھر آپ اسے فائنل کرو اور مجھے نیکسٹ میٹنگ میں جو سمر انٹرنشپس کے حوالے سے ایڈ ڈویلپ کرنا ہے اس کا سیمپل دکھائیں گی,ہاں
اوکے گریٹ یہ پارٹ ایڈ کرنے کے بعد آپ نے میرے ساتھ  شیئر کرنا ہے ,ہاں
ٹھِیک ہے پھر ویریفائی میں کر دوں گی آپ جلد ہی بنا کر شیئر کر دیں ,ہاں
آپ دونوں کو جو ڈاکومنٹس میں نے بولے ہیں وہ مجھے سبمیٹ کروا دینا,ہاں
یوز تکنیکس لائک مسکو ٹو پرائیورٹائز ,ہاں
ابھی نہ شیئر کریں آپ میٹنگ کے بعد شیئر کر دیجئے گا,ہاں
اچھا اب ارحم آپ نے ایک کمپلیٹ سٹریٹیجی شیئر کرنی ہے انٹیگریشن ٹیسٹنگ کی,ہاں
پورے پراجیکٹ کی ریکویئیرمنٹس کی کونٹینیوئس مانیٹرنگ کے لیے ایک پراسس کو اگلی سپرنٹ تک ایسٹیبلیش کریں۔,ہاں
اور اگر پسند آتا ہے تو پھر مجھے آ کے م فزیکلی اگر بتا سکتے ہیں تو فزیکلی بتا دیجیے گا تو پھر ٹیوز ڈے کو آرڈر پلیس کرنے چلے جانا آپ,ہاں
اسٹیک ہولڈرز کے ساتھ ریکویئیرمنٹس کو پرسوں تک ویلیڈیٹ کریں ,ہاں
بریرہ آپ نے سارے گروپس سے ٹیسٹنگ کی رپورٹ لینی ہے,ہاں
جیسے کہ پہلے بات کی ہے بجٹ کے لحاظ سے پہلے ایک بار دیکھ لیجئیے گا کیونکہ اگر تو اس کی اے پی آئی فری پڑی ہو گی تو پھر تو ٹھیک ہے ورنہ اس کی اے پی آئی آپ کو بائے کرنا پڑے گی,ہاں
لائبہ اب آپ نے امپورٹنٹ پوائنٹس نوٹ کرنے ہیں,ہاں
اور ہم نے جو سکیما ڈیسائیڈ کیا ہے اس کے اکورڈنگ آپ نے ٹیبلز کرئیٹ کرنے ہیں,ہاں
اچھا آپ نے  ایپ کی اے پی کے کاشف کو بھی سینڈ کرنی ہے,ہاں
تو اب آپ نے ٹائملی کام کروانا ہے,ہاں
آپ نے ایمپلیمنٹ کرتے وقت اس چیز کا لازمی دھیان رکھنا ہے,ہاں
ٹھیک ہے اور ایسا کرو کہ شارٹ لسٹڈ کینڈیڈیٹس کی سی وی بھی میڈم کو میل کر دیںا ٹھیک ہے,ہاں
عمر آپ نے کل تک ایونٹ کی ساری بیلنگ کلئیر کرنی ہے,ہاں
اچھا آپ نے نا میرے ساتھ جو بھی ریکوائرمنٹ ڈاکومنٹ ہے وہ شئیر کرنے ہیں,ہاں
ماورا آپ مجھے نیو ایپلیکنٹس کی سی ویز ایک دفعہ ریویو کروا دینا نیکسٹ میٹنگ میں,ہاں
اور وہ فولڈر میرے ساتھ  شئیر کرنا ہے,ہاں
آئی او ایس اور اینڈروائیڈ دونوں ورژن اگلے ہفتے تک ڈیولیپ کریں۔,ہاں
امپلیمنٹیشن کے لیے اپروپریئیٹ بلاکچین پلیٹ فارمز، سمارٹ کنٹریکٹ فریم ورک، اور ادر نیسسری ٹیکنالوجیز کی کل تک ریسرچ کریں اور ان کو سلیکٹ کریں,ہاں
اوکے قاسم آپ مشین لرننگ والے پروجیکٹ کا فیزیبیلیٹی انالیسز کریں اس ویک,ہاں
چا ہے تو وٹس ایپ پر بنا لیں آی ایم کمفرٹیبل ,ہاں
اچھا آپ نہ اس کی اے پی کے شئیر کر دینا تاکہ میں بھی ایک دفعہ چیک کر لوگا ,ہاں
ماریہ آپ کالجز کی لسٹ دیکھ لیں,ہاں
اس کے بعد ۱۹ جون تک ارم آپ نے ساری ڈاکومنٹیشن کو ریویو کرنا ہے  ,ہاں
عمر آپ نے کل کو اس ای او کی ٹیم سے میٹنگ کرنی ہے اور ان سے اپنی ویب سائیڈ کی اس ای او کروانے کے ریلیٹڈ انفارومیشن لینی ہے,ہاں
برئیرہ آپ نے مس سہر کے ساتھ سمری والے بچوں کا ڈیٹا جو ہے وہ ان کو سینڈ کرنا ہے,ہاں
اسی طرح ایک اور میٹنگ اپ لوڈ کی تو کی ورڈز اب یہ جو میٹنگز میں لیٹ سپوز تین میٹنگز ایک پروجیکٹ کے اندر اپلوڈ کی ہیں,ہاں
عروسہ اور سمی آپ لوگ سکیجوئلپرووائیڈکر دیں مجھے,ہاں
احمد اس پلان کو ایمپلیمنٹ کرنے کی رسپانسبلٹی بھی آپ پر ہے,ہاں
تو پھر آپ :م: جو ہے وہ رات تک پھر مجھے ای میل کر دینا,ہاں
ایڈورٹائزنگ کے لیےٹارگٹ آڈیئنس اور جغرافیائی ایریاز کو اگلے ہفتے تک آئیڈنٹفائی کریں۔,ہاں
اچھا جو یوزر انٹرفیس ہے وہ علی آپ بنائیں گے,ہاں
ٹیم اس ہفتے تک اس بات کو اینشور کرے کہ کولیکٹ کی گئی  ریکویئیرمنٹس ٹھیک ہیں,ہاں
برئیرہ آپ نے نا آج کل میں ہی اپنی ویب سائیڈ کی ایک ویڈیو کریٹ کرنی ہے ,ہاں
اس کی آپ نے مجھے رپورٹ بنا کے سینڈ کرنی ہے,ہاں
کلاسیفیکیشن کے لیے ایف ون اسکور کا سلیکشن ہوا ہے تو اپ نیکسٹ ویک ٹیم کو انفارم کر دیجئے گا ,ہاں
کاشف ڈاکومنٹ بنانے کے بعد مجھ سے ایک دفعہ کنفرم کروا لینا,ہاں
اس کے بعد آپ لوگوں نے ماڈل ٹریننگ کی طرف آناہے,ہاں
 آپ ڈاکومنٹ میں یہ بھی ساتھ مینشن کر دینا ,ہاں
علی آپ نے کل تک ہوم پیج کو کومپلیٹ کرنا ہے,ہاں
آپ ان سے بات کر لیں ڈیل فائنل کر کے مجھے بتائے گا,ہاں
فاطمہ ٓپ کا ٹاسک ہے کہ ٓپ نے ڈیٹا بیس کے لیے ڈفرنٹ پلیٹ فارم سرچ کرنے ہیں پرسوں تک,ہاں
کر کے پھر آپ کو بھیج دوں,ہاں
اوکے سو آپ لوگوں نے اب تمام سی ویز کو ری چیک کرنا ہے اور ریکوائرمنٹس کو مدنظر رکھتے ہوئے پانچ کنڈیڈیٹس کو شارٹ لسٹ کرنا ہے,ہاں
میٹنگ میں ہونے والی ڈسکشن پر کوئی اضافی معلومات شامل کرنے کی ضرورت ہے اس کو کل تک کومپلیٹ کریں,ہاں
:م: نیکسٹ پوائنٹ ہمارا ڈیٹا انٹیگریٹی ویلیڈیشن کا ہے کہ یعنی اس میں ہم نے ڈیٹا کی انٹیگریٹی چیک کریں گے کہ یہ اس کی ویلیڈییشن :م: ٹھیک ہے یا نہیں,ہاں
پھیپھڑوں کی بیماری کا پتہ لگانے کے لیمیٹیشنز کو کل تک ایکسپلین کریں۔,ہاں
کل آپ آفس آتے سب سے پہلے ایڈ جنریٹ کریں اور م,ہاں
اس لیے میں نے آپ سے کہا کہ کلائنٹ سے کنفرم کریں ,ہاں
آپ سب نے ان سب فریم ورکس کو ایکسپلور کرنا ہے,ہاں
یہ جو لیگ ہے یہ تو آپ نے آج ہی کمپلیٹ کرنا ہے ناں ایکشن آئٹمز بھی ایک دفعہ دیکھ لینے ہیں کہ صحیح آپ لوگوں نے کیے اور دوسرا سمری بھی کر لینی ہے اس کی یہ سمری عموماً جیسے میٹنگ کمپلیٹ ہو تب ہی ہو جائے تو زیادہ بہتر ہوتا ہے,ہاں
اچھا آپ نے جو یہ ٹیسٹ کیسزز بتائے ہیں اسے ساتھ نوٹ بھی کرنے ہیں ,ہاں
اب آپ ایسا کریں کہ کل کمپنی میں خود جا کر کمپنی سے بات کریں اور ان کو ساری صورتحال سے آگاہ کر کے جلد سے جلد ریکوری کرنے کا کہیں,ہاں
سسٹم پرفارمنس اور ریسورس یوٹلائزیشن کو مونیٹر کرنے کے لئے ٹاسک امپلیمنٹیشن سٹارٹ کریں,ہاں
یونٹ اور انٹیگریشن ٹیسٹنگ کے حوالے سے ڈیٹیلز مجھے ہارون ٓپ پرووائیڈ کریں گے اور میرے ساتھ ٹائم ٹو ٹائم ڈسکشن کرتے رہیئے گا,ہاں
سمی پھر اپ ہی اس طرح کریں کے ایک آنلائن فل کروانے کے لیے  کویسچنئیر بنا لیں اور مجھ سے پہلے ایک بار ویریفائی کروا لیں ,ہاں
پھر اسی کے اکارڈنگ کام کر لیں,ہاں
آپ اس کوڈ کو دوبارہ چیک کرنا,ہاں
اب جو نیکسٹ ہمارا مشین لرننگ کا پروجیکٹ ہے اس کے لئے عائشہ اپ نے ایک میٹنگ شیڈیول کرنی ہے جس میں اسٹیک ہولڈرز اور ٹیم ممبرز شامل ہوں گے ,ہاں
آپ لوگوں نے کل کو اپنے ٹیچر سے اپلیکشن پہ سائن کروانے ہیں ,ہاں
اور اس کے علاوہ آپ پھر ایک دو دن تک آرڈر دے دیں لیپ ٹاپس کے لیے کسی اور وینڈرز کو,ہاں
حمد آپ نے مجھے میٹنگ کی ریکارڈنگ اور سمیز شئیر کرنی ہیں,ہاں
عمر آپ نے کو نٹیو وید گوگل اکائونٹ کا سائن ان پیج پہ اپوشن بھی ایڈ کرنا ہے,ہاں
عمیر کے ساتھ شیئر کر دیجیے گا وہ ٹویٹس,ہاں
ارم آپ ٹیم کے ساتھ مل کر نیکسٹ ویک تک ایکسیسیبلٹی ٹیسٹنگ کا پلان بنائیں    ,ہاں
اس کے لیے سر سے اور ڈائریکٹر صاحب سے سگنیچرز کروانے ہیں دس ویک,ہاں
بہترین پرفارمنس کے لئے ہائپرپیرامیٹرز کو اپٹائمائز کریں اور ٓپس میں ڈسکس کرنا ہے ٓپ نے,ہاں
لائبہ آپ مجھے اس بارے میں  بعد میں انفورم کردینا,ہاں
نیکسٹ میٹنگ میں سب پروپوزل پڑھ لینا تاکہ ہم پھر پروپرلی کام سٹارٹ کریں,ہاں
عمر آپ نے کل اپنی فرنٹ اینڈ اور بیک اینڈ ٹیم سلیکٹ کر کے مجھے سینڈ کرنی ہے,ہاں
کاشف آپ نے آج کی میٹنگ کے امپورٹنٹ پوائنٹ نوٹ کر لینا,ہاں
آپ لوگ ورکنگ کریں اس پہ,ہاں
نیکسٹ ویک تک صبا جو کوئز مینجمنٹ ایپ کا کونٹینٹ ہے اس کو تھورلی ریویو کروا لیجئے گا  ,ہاں
توٹھیک ہے پھر ان کا ویٹ کر لیں اور دو دن بعد ان کا بھی انٹرویو کنڈکٹ کر کے ان میں سے جنہیں ہائیر کرنا ہوا اور جو میم کے کنڈیڈیٹس ہیں ان کو بھی ایک دن آفس بلوا کر ان سے کنٹرکٹ سائن کروا لیجیئے گا,ہاں
ایک اے پی ٓئی ماڈل کی بنانی ہے ٓپ نے اور ایک سپیچ ٹو تیکسٹ کنورژن کی,ہاں
ویب سائٹ کو پریویس ایشوز سے بچنے کے لئے علی اپ نیکسٹ ویک تک اس کی ریگریشن ٹیسٹنگ بھی کریں گے    ,ہاں
آپ نے اب یہاں سے  ٹیسٹ ڈیٹا لے کے مجھے چیک کروانا ہے ,ہاں
جو ڈیٹا اینالسز ڈاکومنٹس پینڈنگ ہیں جنہیں آپ نے نیکسٹ میٹنگ میں ڈاکٹر صاحب سے ڈسکس کرنا ہے اسے وائنڈ اپ کریں,ہاں
کنسینٹ فارمز بھی آپ نے لے لینے ہیں ان سے,ہاں
اس کے بعد حنا آپ کمیونیکیشن پلان کو اپ ڈیٹ کریں جو کلائنٹ کی ایکسپکٹیشن اور پروجیکٹ پروگریس کے بیچ میں کوآرڈینیشن بڑھانے کے لئے بنایا گیا تھا  ,ہاں
 انفیکٹ میٹنگ کے بعد ابھی تک کی پروگس کی ریپورٹ شیئر کر دیں آپ مجھ سے,ہاں
