question,answer
ہاں جی بالکل آج اسی لیے میں یہ میٹنگ کنڈکٹ کی ہے کہ ہم ان انٹرنز کو نیو پراجیکٹ میں شفٹ کر رہے ہیں,نہیں
اتنا تو یہ منوانا آپ کا کام ہے,نہیں
کہ ہماری ناں ساتھ ساتھ تھوڑی تھوڑی :م: وہ ریکارڈنگ شروع ہو جائے بعد میں پھر ہم اکٹھی ایک ہی دفعہ,نہیں
کہ ان کی طرف سے کوئی کمپلینٹ نہیں آئے گی,نہیں
م میم مجھے تو اقصی صحیح لگی ہے,نہیں
اس طرح پھر یہ ہے کہ ڈے بھی ویسٹ نہیں ہوتا,نہیں
کہ وہ م ان کی طرف سے ہے یا نہیں ہے ہم ان کو بلیم تو نہیں ناں کر سکتے ہیں کیونکہ وہ ہمارے کسٹمر ہیں آفٹر آل,نہیں
کر کے دیکھا اب ایسا کوئی سین نہیں ہے,نہیں
نیکسٹ آپ کے ساتھ کاشف بھی آپ کی ٹیم کا پارٹ ہوگا ,نہیں
سرابھی تو ویسے ہی جن کی سی ویز ہمیں سوٹیبل لگی تھیں توان کو شارٹ لسٹ کیا ہے,نہیں
جی سر ہم نے لو لیول اور ہائی لیول دونوں پر ڈیٹیلڈ ڈسکشن کر لی تھی,نہیں
کیوںکہ ہو سکتا ہے اوپر نیچے کسی کی پرائز ہو تو وہ پھر ہم اسی بجٹ کے اندر سے ہی م جو ہے فل فل کر سکیں ٹھیک ہے,نہیں
کا مسئلہ نہیں ہوا باقی جو امپلائز کچھ لیٹ آئے تھے,نہیں
:م: مبشر کہ آپ کی ٹیم میں ایکسپرٹیز کون سی,نہیں
کے اگر تو زیرو پوائنٹ زیرو سے لے کے ون پوائنٹ زیرو تک ویلیوز اس نے میپ کی ہیں ٹھیک ہے,نہیں
اور اس کے علاوہ یہ اس کے ڈیٹا سیٹ کو میں نے ڈاون لوڈ بھی کیا تھا میں آپ کو فردر جو ڈاون لوڈ ڈیٹا سیٹ ہے وہ دکھاوں گی کہ اس کے اندر انہوں نے کیسے کام کیا ہوا ہے,نہیں
تو مجھے ابھی سینڈ کر دیں میں ان کو ریویو کر دوں گا,نہیں
ور اس کا اس کے اوپر کسی بھی قسم کی جو ہے ناں وہ میں انکنوینئنس نہیں چاہتی ہوں کہ کوئی بھی ہمیں کسی بھی قسم کی چاہیے وہ کرپشن کی ہو چاہے وہ سستی دکھانے والی ٹائپ کی ہو,نہیں
تو سر اب اس حوالے سے کیا کرنا چاہیے,نہیں
:م: ٹھیک ہے بالکل یہ بہتر رہے گا اور کوئی کسی کا کوسچن ہو اس سے ریلیٹڈ آج یہ اچھا ویسے یاد آ گیا ہے اس میں :م: انہوں نے کہا تھا لینگویج پریفرنسز کا,نہیں
میں بھی ٹھیک اور کام کیسا چل رہا ہے آپ سب کا,نہیں
ہاں جی ظاہر ہے اب ساری بجٹ انفارمیشن ایک بندے کے پاس ہوتی ہے اب اگر وہ وداوٹ انفارم کیے لیو کر جائے تو بہت ایشو ہوتا ہے,نہیں
کے م کہتا ہے کے نارملائزنگ اردو ٹیکسٹ,نہیں
تو کیا آپ نے ڈسکس کیا ہے اس پر,نہیں
تو کنسیڈر کیا جا سکتا ہے انہیں,نہیں
جی میم اور ساتھ یہ بھی چیک کرے گے یہ پراپر ایرر میسج ڈسپلے کرواتا ہے یا نہیں,نہیں
میم ایز سچ تو نہیں آیا ,نہیں
مآپ کی باتیں تو ویسے غور طلب ہیں ان میں وزن تو ہے ویسے,نہیں
کا ڈیزائن بن رہا ہے جو بھی :م: اس نے کلر سکیم,نہیں
نہیں اب صحیح ہو گئی ہے,نہیں
تو ہماری کوشش ہے کے ٹینڈر والا کام آپ کو پتا ہے کہ جلدی نہیں ہوتا تقریبا جو ہے ٹینڈر ایکسیپٹ ہونے میں میں م دو سے تین ماہ جو ہے وہ کم از کم لگتے ہیں اور زیادہ سے زیادہ آٹھ ماہ تک بھی جا سکتا ہے ٹینڈر ایکسیپٹ ہونے میں ٹائم,نہیں
بیک اپ ہے کوئی آپ کے پاس لیپ ٹاپس وغیرہ کا اگر کسی نے یہاں پروجیکٹ پہ جس طرح کام چل رہا ہے,نہیں
پھر ان کی طرف سے اگر کچھ م ایڈیشن انھوں نے کچھ کروانی ہوئی یا چینجنگ کروانی ہوئی وہ ہمیں بتا دیں گے ہم ایڈٹ کر کے پھر ان کو دیں گے,نہیں
ہماری اس میں ہمارے پاس جو یو ار ایل ہے وہ چیک کرنا ہے کہ وہ سکیور ہیں,نہیں
جی سر میں نے کر لیا نوٹ,نہیں
اور اس کے علاوہ م ان کو جو ایکسٹرا نہیں ہم وہ دے سکتے م چھٹیاں جو ہیں ناں تو اس منتھ میں کور کیا کریں گے یہ اس کو,نہیں
:م: ود ان دی ڈیٹا سیٹ کوئی ڈپلیکیٹ آپ نے وہ کوئی چیز وغیرہ پروڈکٹ تو نہیں ایڈ کر دی کلائنٹ کی یعنی کہ کلائنٹ نے اگر ایک آرڈر کہا ہے تو آپ نے اسے دو دفعہ ایڈ کر دیا ہے تو آپ نے یہ بھی ویریفائی کرنا ہے ڈیٹا میں ہم نے ڈوپلیکیشن کو :م: ریموو کروانا ہے,نہیں
م نیکسٹ ٹائم جو ہے ناں اب ہمارا آرڈر جو ہو گا ناں انہیں ایڈوانس میں پیمنٹ نہیں کرنی,نہیں
م ہائرنگ سکیجوئل وغیرہ کا اس کا ڈسکس کرنا تھا تو,نہیں
اگر ہم ان کو وہاں ٹرانسفر کریں گے تو یہ وہاں بڑے گڑبڑ کریں گے اور آپ کو تو پتا ہے کہ وہاں پر ہمارے پاس م زیادہ سے زیادہ جو ہیں,نہیں
دیے ہیں انہوں نے اچھے سے,نہیں
یس سر وہ تو ہم دو طریقوں سے کر سکتے ہیں ناں مطلب کہ ان,نہیں
پروسیسنگ میں ہی :م: کمپلیٹ کر لیا تھا اس کے بعد پھر ہم لوگوں نے اس کی,نہیں
تو آپ ناں ذرا جو پیپرز ہیں ان میں بھی دیکھ لیں کہ انہوں نے ڈیٹا سیٹ کتنا بڑا لیا ہوا ہے,نہیں
جیسے کہ کسی بھی چیز کے بارے میں اس کی انفارمیشن رٹریل کرنا ڈیٹا کی ویلیڈیشن کرنا وغیرہ,نہیں
جو اماونٹ ہم نے لیپ ٹاپس پر انویسٹ کرنی تھی وہ چلو ان کی پرچیزنگ پر انویسٹ کر سکتے ہیں,نہیں
تو :م: پھر آپ مجھے بتا دیجیے گا پھر ہم اسی حساب سے شیڈول کر لیں گے,نہیں
:م: شاید وہ بھی نہ آپ لوگوں کو جانتی ہوں چلیں میں آپ کا کروا دوں گی اگر :م: ضرورت پڑی,نہیں
آ ہاں بالکل ایسے ہی ہے اور :م: {لائبہ} آپ نے ایسا کرنا ہے کہ جو پرائمری کیز,نہیں
اوکے آئی ویل اپ ڈیٹ دی فائنل ڈیزائن ڈاکومنٹ,نہیں
ہاں ہاں میں دوبارہ بتا دیتا ہوں,نہیں
میم جو ڈاکومنٹ ہم  نے بنایا ہے اسی میں ایڈ کر لے یا سیپرٹ بنا لے ,نہیں
:م: میم ابھی سٹارٹنگ ہے تو پھر آہستہ آہستہ ہم سپیڈ اپنی انکریز کر لیں گے,نہیں
کرنا چاہوں گا کہ تاکہ وہ میرے کلیئر ہو جائیں,نہیں
جی بالکل میم آرڈر م ریڈی ہے سب کچھ سیٹ ہے لیکن ایک پرابلم ہو گئی ہے کل رات کو ناں,نہیں
م ان سے ناں آپ زیادہ بڑے سائز کے نہ لیجیے گا کیونکہ آفس میں اتنی سپیس نہیں ہوتی ہے تو اگر اتنے بڑے ہم رکھ لیں گے ناں تو پھر سٹنگ کا پرابلم ہو جائے گا ہمارے لیے,نہیں
کے ٹھیک ہے دین پھر اب دیکھو,نہیں
ان سے ڈسکشن کے بعد یا تو آپ کشف کو کہہ دینا کہ وہ ریکویسٹ لیٹر کریئیٹ کر لے یا آپ خود کر لینا,نہیں
تھے ڈائس اور ڈیسکس وغیرہ ہیں,نہیں
ڈیٹا کلیکشن کی ریکوائرمنٹس کیا ہوں گی کیا انٹینٹس کور کرنے ہیں پراجیکٹ ریکوائرمنٹس کیا ہیں وغیرہ,نہیں
اور ان کو ڈیلیٹ اور جو ہمارے پاس کرپٹ کر رہے ہیں,نہیں
ٹیبل کی فارم میں آپ نے کرنا اس طرح سے ہے,نہیں
اچھا جی تو اس میں سر {سرمد} کی طرف سے کوئی ٹائمنگ وغیرہ تو نہیں تھی کہ یہ چیز آپ نے تب کر کے دینی ہے تب تک ہو جانی چاہیے یہ وہ,نہیں
جی سر میں کر دوں گا آپ کے ساتھ شئیر,نہیں
:م: ڈسٹورشن بہت زیادہ ہے آواز میں,نہیں
ٹھیک ہے میم یعنی ہمیں پھر اور ہائرنگز کرنی پڑیں گی ان کی جگہ پہ بھی,نہیں
ڈفرنٹ ڈفرنٹ شیپس ہوتی ہیں اور الف مد آ د ز ر,نہیں
اور اب تو یہ ہے کہ وہ کمپنی جو ہے وہ اسے ایکسیپٹ بھی نہیں کرے گی کیونکہ ہم نے ایک بار جو رپیئر کروا لیا اس کو تو کمپنی کا سب سے بڑا ایشو یہ ہی ہوتا ہے کہ وہ سب سے پہلے یہ ہی پوچھتے ہیں کہ جی آپ نے اس کو پہلے کہیں چیک کروایا ہے,نہیں
میم یہ بھی مینشن کر دین کہ ہم اس میں این ایل پی کی ڈفرنٹ آنسر رینکنگ ٹیکنیکس یوز کر رہے ہوں گے,نہیں
نہیں سر ان کی میٹنگ ڈسکنیکٹ ہو گئی ہے شاید,نہیں
میم مزید ہم یا پھر کر لیں گے کبھی,نہیں
اسی طرح وہ ہر ایک سنٹینس کی اس نے ایک لینتھ,نہیں
یس میم وی ول میک اٹ شیور,نہیں
پرانڈ کی چاہیے ہو گی اس میں بھی,نہیں
جی سر ایسا ہی ہونا چاہئیے تھا,نہیں
ویسے تو میجر میجر یہی کمپوننٹ ہیں ,نہیں
کہ وہ منع کر دیں گے یہ ڈاوٹ ہے,نہیں
اچھا تو اب ہم اپنی ایپلیکیشن کو ڈپلوئے کرنے جا رہے ہیں,نہیں
م ابھی بھی جو کرنٹلی اس میں سے کچھ لائک کچھ لوگ ورکنگ میں ہیں,نہیں
اگر ان کا کسی اور ہاسپیٹل میں بھی ریفرینس ہے,نہیں
آمین جی مجھے آپ لوگوں کی میل آئی تھی تو اب تھوڑی طبیعت بہتر ہوئی تو میں نے سوچا آن لائن میٹنگ ہی کنڈکٹ کر لیتے,نہیں
اے ایس آر کی ٹیم بھی یوز کر رہی تھی اسے تو وہ ذرا دیکھنا ذیشان لوگوں سے پوچھنا کہ وہ یوز میں لائی جا سکتی ہے کہ نہیں,نہیں
:م: شور میم میں آپ کو ناں تین سے چار سیمپلز بنا کے شیئر کروں گا :م:,نہیں
ودان دی ڈیٹا سیٹ کوئی ڈپلیکیٹ بک تو ایڈ نہیں ہو گئی,نہیں
:م: ٹھیک ہے :م: میٹنگ میں سب جوائن کر لیا ہے,نہیں
پروجیکٹ ریکوائرمنٹ انسیپشن میں اتنا وہ ٹائم لے لیتے ہیں کہ باقی کاموں کے لیے ٹائم بچتا نہیں ہے حالانکہ ٹائم اس میں اتنا نہیں لگنا چاہیے جو باقی اور کام ہے اس میں,نہیں
کہ جی میں آپ سے بات کرنے آئی تھی اور آپ نے مجھے یہ کہہ دیا کہ جی امپلائز کی مسٹیک ہے تو اس طرح یہ تو نہیں کہ اب ہم خاموش بیٹھے رہیں آپ آگے سے رسپانس نہ کوئی دیں تو ہم آپ کے انتظار میں بیٹھے رہیں,نہیں
اگر میں سکرین شیئر کروں اپنی,نہیں
جی میم یہ کام اب لوپ میں رہ کے کام کریں گے,نہیں
آؤٹ لائرز مییرمینٹ ایررز ڈیٹا اینٹری میسٹیکس یا ایکسٹریم انوائرمینٹل کنڈیشنز کی وجہ سے اکر ہوسکتے ہیں,نہیں
تو وہ جلدی آپ کو ڈیٹا بھی نہیں ملے گا,نہیں
ابھی تک کسی کی طرف سے کوئی ایشو تو نہیں ہوا,نہیں
جو رسک مینجمنٹ کا آپ نے بتایا ہے,نہیں
ہاں جی آپ کو {اسما} آواز آ رہی ہے,نہیں
اور ری کال زیرو پوائنٹ ایٹ فائیو تھی,نہیں
جس میں یوزر کی ایج سٹور ہوگی,نہیں
اس کی یہ چیز بھی ایڈ کر دیجیے گا کہ ٹریننگ م ول بی انکلوڈڈ ان دی آفس ٹھیک ہے,نہیں
اب یہ کسی کے بارے میں کسی کے بارے میں,نہیں
تو ہم ان الگورتھم کے تھرو ہم ان کو سینٹینس کو آئیڈینٹیفائی کر دیں گے,نہیں
جی گڈ اور آپ نے یہ ٹرائے کرنی ہے کہ جو یوزر کا انٹرفیس ہے صرف اسی کی اسے ایکسیس ملے ایڈمن کی نہ ملے ,نہیں
ڈونٹ وری میں یہ کام کر لوں گا,نہیں
ہے تو اسی لیے ہم نے میوزک میں مارک کیا ہوا ہے,نہیں
آپ نے کس طرح بنائی ہیں اینٹٹی,نہیں
اور م دوسرا یہ کہ اگر ان کا ایکسپیرئنس ہو گا تو زیادہ بہتر ہے نہ بھی ہو گا تو چلے گا لیکن اب جو م پرائیورٹی دینی ہے ناں وہ آپ نے ایکسپیرئنسڈ کو ہی دینی ہے,نہیں
تا کہ کسی بھی قسم کی کنفیوژن یا کوئی مس انڈرسٹینڈنگ نا رہے,نہیں
اچھا ہاں فی الحال یہ کوشش کیجیے گا کہ ابھی آپ کسی نیو وینڈر سے م نہ ہی کریں جو ہمارے پاس پہلے سے وینڈرز جن سے ہم کام کروا رہے ہیں اپنے چیزیں وغیرہ منگواتے ہیں فی الحال ابھی انہی کو سیلیکٹ کیجیے,نہیں
میم اس کے علاوہ ود ڈیفرنٹ ڈیوائسز سسٹم کی کمپیٹیبلٹی آجاتی ہے,نہیں
تو :م: میں کہہ رہی تھی کہ اس کا بھی تھوڑا سا ہم اس پر بھی بات کر لیتے ہیں کہ ہمیں اور,نہیں
تو اس لیے ناں میرا خیال ہے کہ پہلے ہم ان کی طرف سے کلئیر کر لیتے ہیں وٹ ڈو یو سے,نہیں
وہ ایچ آر کو سبمٹ کروا دینی ہے آپ نے,نہیں
سرور سائیڈ پر پھر یہ ہوگا کہ ہم کلاؤڈ سرور کا یوز کریں گے,نہیں
تو اس پوائنٹ پہ بھی ہم اسی طرح کام کریں,نہیں
تو ان سب کو آپ نے ایڈ کر دینا ہے ٹھیک ہے,نہیں
:م: نو میم میرا خیال ہے کہ ہم لوگوں نے سارے پوائنٹس کو ڈسکس کر لیا ہوا ہے اور ساری سب موڈیولز بھی ہو گئے ہیں اور سب :م: ماڈیول بھی ہو گئے اور سب موڈیولز بھی ہو گئے ہیں,نہیں
انٹرنشپ کی ہوئی ہے مینجمنٹ میں,نہیں
جو ٹیکنیکلز کی ٹیم ہے ہمارے پاس وہ م ان کو ففٹی ٹو سکسٹی تھاوزنڈ کا مارجن,نہیں
{عرفان} وغیرہ کا بھی آئی تھنک یہ ہی ایسا ہی کچھ,نہیں
میم میں یہاں یہ ایڈیشن کرنا چاہوں گا کہ جو وائر فریمز ہے اس میں ہمیں کونسسٹینسی رکھنی ہوگی,نہیں
ہاں جی کچھ سٹارٹ تو کریں ناں کچھ,نہیں
اور کے ایس کے بھی ہم آپ کو بھیجیں گے اور آپ نے پریشان نہیں ہونا,نہیں
ٹھیک ہے تو پھر اس پہ کام کریں آپ لوگ,نہیں
جو سٹیز :م: سے ہمیں ٹویٹس سرچ کرنی تھی تو اس میں ناں ہمیں لوکیشنز,نہیں
میم اب ایسے جو میں نے :م: فور پارٹیسپینٹس والی میٹنگز لکھی ہیں تو اس میں بیلنس کر دیتی ہوں اگر دو میلز ہیں تو دو فی میلز کر دیتی ہوں,نہیں
:م: امیجز یا :م: ڈسکرپشنز وغیرہ کے ساتھ جو ہے ناں وہ ڈیل کریں گے اس چیز پہ,نہیں
 جس میں  ہم میکسیمم ٹیگز ڈیفائن کرلیں گے ,نہیں
ورچوئل ڈوم میں بات کی جائے ریئل ڈوم جو ہوتا ہے وہ :م:,نہیں
جو میننگ فل ریسورسز ہیں جو ہمیں چاہیے ریکوائرڈ ڈیٹا,نہیں
پریزنٹیشن لئیر بزنس لاجک لئیر اور ڈیٹا ایکسس لئیر,نہیں
ہاں کافی چیزیں ڈسکس ہو گئی ہیں,نہیں
تو اس میں یہ ہوتا ہے کہ اگر ایک بندہ تھوڑی بہت مسٹیک کر بھی رہا ہو ناں,نہیں
اس کو کاپی کر رہی ہوں ان کا ٹیکسٹ جو ہے یہ میں نے جو آپ کو ابھی دکھایا تھا ناں یہاں یہ,نہیں
پرانے جو لیپ ٹاپ ہیں ان میں بھی ریم کا ایشو ہے تو کیا انہیں بھی ایکسٹینڈ کروانا ہے,نہیں
دیکھیں اس کا یہ ہوتا ہے کہ آپ کا جو ریلیٹڈ ورک ہوتا ہے وہ ہمیشہ ایک سٹوری کی طرح سے ہوتا ہے ہم ایک تمہید سی باندھتے ہیں کہ جی,نہیں
میری آواز آ رہی ہے اب,نہیں
وہ بیچ میں ڈسٹریکٹ ہو گی ناں,نہیں
ان کو ڈپلوئمنٹ :م: سرور پر کنسیڈر کرنا ناں لائک بہت زیادہ ضروری ہے,نہیں
ہاں وہ ہی ناں آئی سٹل ریمیمبر کہ لاسٹ کینڈیڈیٹ تھیں یہ,نہیں
اس سے آگے سر میں ایکسپلین کرتی ہوں,نہیں
اور سر اس کے بعد سر وہ ایک اور بات کرتا ہے کے,نہیں
جی تو بس اسی لیے پرفارم یور ٹاسک ان آ گڈ وے,نہیں
:م: لائک اس میں پھر اس کے,نہیں
ہاں جی مکسڈ ہی ہو گی جس طرح اب ہم بات کر رہے ناں اسی طرح,نہیں
تو مجھے ایک ضروری کام پڑ گیا تھا جس کی وجہ سے میں آفس نہیں آ سکا,نہیں
کس لینگویج میں زیادہ یوز ہو رہا ہے تو اس کے اکورڈنگ پھر اس کو ڈیل کر لیں,نہیں
جی آپ ٹھیک کہہ رہے ہیں لیکن آٹومیٹیڈ بھی پرفارم کرنی چاہیے ,نہیں
جی جی میم میں ادھر ہی ہوں,نہیں
اچھا جو یہ سیکنڈ لائن ہے بریک ہو کے جو سیکنڈ آ رہی ہے,نہیں
اور ڈیٹا میں ویریئیشنز لانے کے لیے میں نے انہیں کہا ہے کہ وہ ان ایجوکیٹڈ لوگوں سے ڈیٹا کلیکٹ کریں کیوںکہ ان کا ڈیٹا سپونٹینیئس ہو گا,نہیں
ہمارے پاس ٹوٹل دو سال کا ٹائم ہے اس پروجیکٹ کے لیے,نہیں
اگر فار ایگزامپل آپ اس کو کبھی یوز کر سکتے ہیں کیسے کریں گے یہ جو آپ نے یہاں نام لکھا ہوا ہے نا اس نے جس پیپر کو کوٹ کیا ہے اندر,نہیں
م جی بالکل ایسے ہی ہے اور آپ تو صرف م ون ٹو ٹو ویکس کی بات کر رہے ہیں ہو سکتا ہے گورنمنٹ کا کام ہے تو ون منتھ بھی ہمارا کنزیوم ہو سکتا ہے,نہیں
:م: بہت زیادہ ٹائم ہمیں ڈیٹا کلیکشن کی فیز پہ ہی لگ جائے گا تو ابھی کے ابھی جو فرسٹ فیز ہے اس میں ہمارا یہی فوکس ہو گا کہ ہم جو مین فلو ہے اس کو کمپلیٹ کر لیں اور جو ہمارا ماڈل ہے اس کی ایکوریسی کو انکریز کر لیں تو اس کے بعد پھر ہم,نہیں
میم جتنے بھی ریکارڈنگ کا گروپ ہیں ناں آپ کے پاس,نہیں
بھی سرچ کر لیں گے اور اگر ٹیبل بنتا ہو گا تین یا چار پہ چار پیپر مل گئے ہیں تو پھر ہم اس کا ایک ٹیبل بنا لیں گے,نہیں
سر جیسے ابھی آپ نے تھوڑی دیر پہلے کہا کہ ایچ آرز کو ایئرلی جسٹ ایٹ لیوز الاو ہیں ورنہ ان کی سیلری ڈیڈکٹ ہو گی,نہیں
اس میں آپ ٹیکسٹ لکھیں گے ٹیکسٹ لکھیں گے اینٹر کریں گے تو ساتھ وہ آپ کو ایموشن بتا دے گا,نہیں
دیکھ سکتے ہیں کہ کس طرح کی ہے اور دوسرا,نہیں
میم وہ ہی ناں جو برانڈ وارنٹی کارڈ پہ لکھا ہوا ہے وہ کوئی اور ہے اور ریئل میں کچھ اور ہے لائک اگر ڈیل کا لکھا ہم نے م,نہیں
آلموسٹ فائنلائز ہو گئی ہے تو امید ہے کہ دو یا تین ہفتوں میں ہم,نہیں
 آپ لوگوں کو لاسٹ ٹائم ایک ڈاکومنٹ کمپلیٹ کرنے کا کہا تھا,نہیں
وغیرہ جو اتنے پروٹوکولز وغیرہ ہوتے ہیں اس,نہیں
ان ہرڈلز سے بچنے کے لیے جو ایپ ہوگا وہ آڈیو میں یوزر کو انفارم کردے گا,نہیں
آپ کے لیفٹ سائیڈ پہ وہاں پر آپ نے خالی بار سلیکٹ کی ہوئی ہے اس وجہ سے وہاں پہ بار آ رہی ہے,نہیں
بٹ میم پرابلم یہ ہے کہ انہوں نے جب سسٹم رن کیے ہیں تو ان کو اس میں کچھ ایشوز آئے ہیں,نہیں
کمانڈ تو ان کی ہے ان کو پہلے بھی میں نے بتا دیا ہوا تھا کی یہ کمانڈ آپ نے پہلے سے ہی اپنی پریپیئر کر کے آنی ہے تا,نہیں
اس تھرسڈے تک ہو جائے گا,نہیں
ہماری ٹارگٹڈ ارگنائزیشن میں سے دو رہ گئی ہیں صرف ان سے میں اسی ویک بات کر لوں گی,نہیں
اچھا ٹھیک ہے اچھا ذرا ناں بجٹ کے حوالے سے ڈسکشن کر لیتے ہیں م ڈو یو ہیو بجٹ اپروول ڈیٹیلز اسامہ,نہیں
:م: اس کے لیے ہم سلیبل بیسڈ الائنمنٹ پہ جائیں,نہیں
اور جیسے ہم نے ڈیٹا کلیکٹ کیا تھا تو ڈیٹا کلیکشن والا سارا پارٹ بھی اس میں آئے اور اس کے علاوہ :م: جو کمپیوٹیشنل پارٹ ہے کہ ہم نے ڈیٹا کو کیسے پراسس کیا اور ماڈل ٹریننگ وغیرہ وہ بھی ایڈ کرنا ہے اس میں تو وہ بھی کافی لمبا ہے,نہیں
تاکہ آفٹر ڈیپلومنٹ ہمیں کسی بھی قسم کے پرفارمنس ایشوز یا کمپیٹیبلٹی کونفلیکٹ کا سامنا نہ کرنا پڑے,نہیں
گڈ جاب آپ لوگوں نے اچھا کام کیا ہے,نہیں
کیونکہ دیکھیں ہمارے جو پراجیکٹس ہیں ان کو سٹارٹ ہوئے ون ایئر سے زیادہ ہو چکا ہے تو اگر فار ایگزامپل یہ آفٹر ون ایئر لیو کرنا چاہیں یا اس سے نیکسٹ ایئر تو پھر کیسے مینج ہو گا یہ,نہیں
م نہیں نہیں میں م اس کی م لائک ہمارا جو پروجیکٹ ہے اس کی کتنی بجٹنگ ہے میں اس کی بات کر رہی ہوں کہ وہ کتنے لاکھ میں بن رہا ہے,نہیں
ساتھ میں ہم نے کچھ لیپ ٹاپس بھی لینے تھے اور ایک ہمارا واٹر ڈسپنسر ہم نے لینا ہے جو پچھلے والا ہے اس میں تھوڑی,نہیں
مین پوائنٹس اینڈ کی آئیڈیاز کے ساتھ ساتھ ڈاکومنٹ ریویور جو ہوگا وہ ادر ریلیوینٹ ڈیٹیلز کو آئیڈینٹیفائی کرے گا,نہیں
جی میم وہ میری والی سائیڈ پہ تھوڑی سی ہو رہی تھی بارش اور یہی تھا کہ,نہیں
تو اس طرح کے ڈیٹا میں :م: فارمیٹنگ کے کافی زیادہ ایشوز آتے ہیں یا :م: ایبریویشنز بہت زیادہ ایڈ کی ہوتی ہیں تو اینوٹیٹ کرتے ہوئے :م: یہ کوشش کرنی ہے کہ,نہیں
وہ ویل نون ہیں تو ان کی گارنٹی بھی ہو گی,نہیں
الحمد للہ مس بس ٹھیک ٹھاک,نہیں
دراصل ناں یہ ایک نیو برانڈ ہے اور یہ اس کی ناں پہلی ایڈ,نہیں
تب آپ کے لیے چیزیں مشکل ہو,نہیں
اپ نے انشور کرنا ہے کہ ان میں جو بگز نکلے وہ ٹائملی ڈویلپر کو اپ نے انفارم کرنا ہے,نہیں
لیکن عادل کے رویے نے مجھے غمگین کر دیا,نہیں
جی السلام علیکم اچھا ایسا ہے کے م اس میں ہمارا ڈاکومنٹ ہے,نہیں
جی سر یہ کوئی اتنا میجر ایشو تو نہیں ہے ویسے,نہیں
انہوں نے م جان بوجھ کر کیوں اس طرح سے کی ہے ورنہ دیکھیں اگر انجانے میں ہوا ہوتا تو چلو کسی ایک آدھ کہ نہ وارنٹی ہوتی,نہیں
اسی طرح اگر کسی میں ملٹیپل ایموشنز ہیں تو جس کی انٹینسیٹی زیادہ ہے,نہیں
ان کی کنڈیشن سے وہ نیو نہیں لگ رہے,نہیں
